{
  "protocol_id": "q3ds-solidworks-mechanical-feature-taxonomy",
  "schema_version": "1.0",
  "taxonomy_id": "mechanical-features",
  "taxonomy_version": "1.0.0-experimental",
  "status": "experimental",
  "requirement_kinds": [
    "opening_and_count",
    "shape_true_form",
    "internal_profile",
    "depth_extent",
    "axis_direction",
    "angular_orientation",
    "location_relation",
    "pattern_relation",
    "transition_detail"
  ],
  "derivation_kinds": [
    "deterministic_geometry",
    "model_feature_data",
    "model_pmi",
    "controlled_user_requirement",
    "planner_engineering_decision"
  ],
  "feature_classes": [
    {
      "code": "overall",
      "kind": "global_shape",
      "parent_code": null,
      "abstract": true,
      "labels": { "zh_cn": "总体形状", "en": "overall shape" },
      "definition": "The global envelope and principal shape of one completed part, not a substitute for local semantic-feature coverage.",
      "scope": {
        "includes": ["Overall envelope, principal axes or planes, and dominant external form."],
        "excludes": ["Local holes, slots, transitions, and manufacturing contexts."]
      },
      "default_requirements": ["shape_true_form"],
      "evidence_needs": ["bounding_box", "brep_face_group"],
      "source_status": "pending",
      "source_refs": [],
      "implementation_status": "vocabulary_only"
    },
    {
      "code": "geometry",
      "kind": "geometric_feature",
      "parent_code": null,
      "abstract": true,
      "labels": { "zh_cn": "几何特征", "en": "geometric feature" },
      "definition": "A local positive, negative, transition, wall, or surface form with independent drawing-expression significance.",
      "scope": {
        "includes": ["Local forms that affect manufacture, assembly, function, or inspection."],
        "excludes": ["Pure relationships and stock-process context."]
      },
      "default_requirements": [],
      "evidence_needs": ["brep_face_group"],
      "source_status": "pending",
      "source_refs": [],
      "implementation_status": "vocabulary_only"
    },
    {
      "code": "structure",
      "kind": "specialized_structure",
      "parent_code": null,
      "abstract": true,
      "labels": { "zh_cn": "专用结构", "en": "specialized structure" },
      "definition": "A standard, functional, or process-specific mechanical structure whose semantics exceed raw B-Rep shape.",
      "scope": {
        "includes": ["Threads, transmission forms, springs, conduits, weld preparations, and formed sheet structures."],
        "excludes": ["Unqualified primitive holes, slots, and transitions."]
      },
      "default_requirements": [],
      "evidence_needs": ["feature_tree_data"],
      "source_status": "pending",
      "source_refs": [],
      "implementation_status": "vocabulary_only"
    },
    {
      "code": "relation",
      "kind": "relation",
      "parent_code": null,
      "abstract": true,
      "labels": { "zh_cn": "特征关系", "en": "feature relation" },
      "definition": "A relationship among semantic features or occurrences that creates an independent expression obligation.",
      "scope": {
        "includes": ["Patterns, symmetry, mirrors, coaxiality, and geometric intersections."],
        "excludes": ["The individual related feature shapes."]
      },
      "default_requirements": ["pattern_relation"],
      "evidence_needs": ["relation_geometry"],
      "source_status": "pending",
      "source_refs": [],
      "implementation_status": "vocabulary_only"
    },
    {
      "code": "context",
      "kind": "manufacturing_context",
      "parent_code": null,
      "abstract": true,
      "labels": { "zh_cn": "制造与毛坯语境", "en": "manufacturing and stock context" },
      "definition": "A controlled manufacturing or stock context that changes drawing rules without becoming a geometric feature itself.",
      "scope": {
        "includes": ["Cast, forged, molded, welded, machined, and formed-sheet contexts."],
        "excludes": ["Geometry inferred only from appearance without a controlled source."]
      },
      "default_requirements": [],
      "evidence_needs": ["controlled_requirement"],
      "source_status": "pending",
      "source_refs": [],
      "implementation_status": "vocabulary_only"
    },
    {
      "code": "geometry.hole",
      "kind": "geometric_feature",
      "parent_code": "geometry",
      "abstract": true,
      "labels": { "zh_cn": "孔", "en": "hole" },
      "definition": "A round or otherwise explicitly typed negative feature organized around an axis and one or more openings.",
      "scope": {
        "includes": ["Through, blind, counterbored, countersunk, stepped, tapered, oblique, and intersecting holes."],
        "excludes": ["Obround slots and arbitrary pockets."]
      },
      "default_requirements": ["opening_and_count", "axis_direction", "location_relation"],
      "evidence_needs": ["brep_face_group", "brep_edge_group", "axis", "opening"],
      "source_status": "pending",
      "source_refs": [],
      "implementation_status": "initializer_planned"
    },
    {
      "code": "geometry.hole.through",
      "kind": "geometric_feature",
      "parent_code": "geometry.hole",
      "abstract": false,
      "labels": { "zh_cn": "通孔", "en": "through hole" },
      "definition": "A hole whose cylindrical or typed passage intersects two external openings.",
      "scope": {
        "includes": ["Simple through passages with two proven external openings."],
        "excludes": ["Blind holes and open-ended slots."]
      },
      "default_requirements": ["opening_and_count", "axis_direction", "location_relation"],
      "evidence_needs": ["brep_face_group", "brep_edge_group", "axis", "opening", "axial_extent"],
      "source_status": "pending",
      "source_refs": [],
      "implementation_status": "initializer_planned"
    },
    {
      "code": "geometry.hole.blind_drilled",
      "kind": "geometric_feature",
      "parent_code": "geometry.hole",
      "abstract": false,
      "labels": { "zh_cn": "钻削盲孔", "en": "blind drilled hole" },
      "definition": "A one-opening axial hole with a controlled cylindrical depth and an explicitly classified bottom form.",
      "scope": {
        "includes": ["Blind drilled holes with flat, conical drill-point, spherical, or otherwise typed bottoms."],
        "excludes": ["Blind pockets without a hole axis."]
      },
      "default_requirements": ["opening_and_count", "internal_profile", "depth_extent", "axis_direction", "location_relation"],
      "evidence_needs": ["brep_face_group", "brep_edge_group", "feature_tree_data", "axis", "opening", "axial_extent"],
      "source_status": "pending",
      "source_refs": [],
      "implementation_status": "initializer_planned"
    },
    {
      "code": "geometry.hole.compound",
      "kind": "geometric_feature",
      "parent_code": "geometry.hole",
      "abstract": false,
      "labels": { "zh_cn": "复合孔", "en": "compound hole" },
      "definition": "A semantically grouped coaxial or otherwise controlled multi-level hole such as a stepped, counterbored, or countersunk hole.",
      "scope": {
        "includes": ["Counterbores, countersinks, spotfaces, and multi-diameter stepped holes."],
        "excludes": ["Unrelated holes that only happen to be near one another."]
      },
      "default_requirements": ["opening_and_count", "internal_profile", "depth_extent", "axis_direction", "location_relation"],
      "evidence_needs": ["brep_face_group", "brep_edge_group", "feature_tree_data", "axis", "opening", "axial_extent"],
      "source_status": "pending",
      "source_refs": [],
      "implementation_status": "initializer_planned"
    },
    {
      "code": "geometry.hole.oblique_or_intersecting",
      "kind": "geometric_feature",
      "parent_code": "geometry.hole",
      "abstract": false,
      "labels": { "zh_cn": "斜孔或交叉孔", "en": "oblique or intersecting hole" },
      "definition": "A hole whose spatial direction or controlled intersection cannot generally be proven by one principal projection.",
      "scope": {
        "includes": ["Oblique entries, radial holes, and controlled intersections between passages."],
        "excludes": ["Principal-axis holes fully determined by one direct opening view and one section."]
      },
      "default_requirements": ["opening_and_count", "internal_profile", "axis_direction", "angular_orientation", "location_relation"],
      "evidence_needs": ["brep_face_group", "axis", "opening", "relation_geometry"],
      "source_status": "pending",
      "source_refs": [],
      "implementation_status": "initializer_planned"
    },
    {
      "code": "geometry.slot",
      "kind": "geometric_feature",
      "parent_code": "geometry",
      "abstract": true,
      "labels": { "zh_cn": "槽", "en": "slot" },
      "definition": "An elongated or section-defined negative feature with controlled width, path, end form, and extent.",
      "scope": {
        "includes": ["Straight, open, obround, key, annular, relief, T, dovetail, sealing, and lubrication grooves."],
        "excludes": ["Round holes and unrestricted pockets."]
      },
      "default_requirements": ["shape_true_form", "depth_extent", "location_relation"],
      "evidence_needs": ["brep_face_group", "brep_edge_group", "axial_extent"],
      "source_status": "pending",
      "source_refs": [],
      "implementation_status": "initializer_planned"
    },
    {
      "code": "geometry.slot.obround",
      "kind": "geometric_feature",
      "parent_code": "geometry.slot",
      "abstract": false,
      "labels": { "zh_cn": "长圆槽", "en": "obround slot" },
      "definition": "A slot with two end arcs or semicircles and a controlled center path, treated as a slot rather than a hole.",
      "scope": {
        "includes": ["Through or blind obround slots with explicit end geometry."],
        "excludes": ["Circular holes and arbitrary rounded pockets."]
      },